{
  "schemaVersion": 3,
  "plugin": {
    "id": "candlescope.fixture-java",
    "name": "Java v3 Fixture",
    "version": "0.1.0",
    "publisher": "candlescope",
    "license": "MIT",
    "engines": {"candlescope": ">=0.4.0"}
  },
  "backend": {
    "entrypoints": [{
      "id": "main",
      "runtime": {
        "kind": "java-jar",
        "artifact": "runtime/fixture-java.jar",
        "runtimeId": "temurin-25",
        "mainClass": "io.candlescope.fixture.Main",
        "jvmArgs": ["-Xmx256m"]
      },
      "transport": "jsonl/1",
      "resourceProfile": "standard",
      "activationEvents": ["onCommand"]
    }]
  },
  "contributions": [],
  "permissions": {"required": [], "optional": []},
  "probes": []
}
